{
  "schema_version": 1,
  "contracts_id": "lambda-ci-execution-contracts-v1",
  "status": "CONTRACT_ONLY_NOT_INSTALLED",
  "authority": {
    "owner": "workspace-control",
    "route_id_is_privilege": false,
    "privileged_runtime_dispatch_key": "resolved_execution_contract",
    "unknown_execution_contract_action": "REJECT",
    "unknown_route_action": "REJECT",
    "experiment_specific_route_names_allowed": true,
    "source_code_change_required_for_new_route_using_existing_contract": false
  },
  "contracts": {
    "cpu-public-ci-v1": {
      "lifecycle": "ACCEPTED_MIGRATION_EQUIVALENT",
      "execution_plane": "jit_runner",
      "execution_profile": "cpu-test",
      "resource_class": "cpu_test_v1",
      "payload_network_class": "GITHUB_CONTROL_PLANE_PLUS_PUBLIC_PAYLOAD",
      "payload_secret_class": "CONTROL_PLANE_EPHEMERAL_ONLY",
      "filesystem_class": "EPHEMERAL_JOB_ONLY",
      "cache_access_class": "NO_PERSISTENT_CACHE_AUTHORITY",
      "state_effect_class": "CI_VALIDATION_ONLY",
      "candidate_payload_allowed": true,
      "model_binding_mode": "FORBIDDEN",
      "runtime_binding_mode": "OPTIONAL_EXACT_IF_ROUTE_BINDS",
      "gpu_count": 0,
      "admission_enabled_after_generic_activation": true
    },
    "gpu-single-public-ci-v1": {
      "lifecycle": "MIGRATION_PLUS_P6_VALIDATION_REQUIRED",
      "execution_plane": "jit_runner",
      "execution_profile": "gpu-small",
      "resource_class": "gpu_small_v1",
      "payload_network_class": "GITHUB_CONTROL_PLANE_PLUS_PUBLIC_PAYLOAD",
      "payload_secret_class": "CONTROL_PLANE_EPHEMERAL_ONLY",
      "filesystem_class": "EPHEMERAL_JOB_PLUS_EXACT_TRUSTED_READONLY",
      "cache_access_class": "EXACT_TRUSTED_OBJECTS_READONLY_OR_NONE",
      "state_effect_class": "CI_VALIDATION_ONLY",
      "candidate_payload_allowed": true,
      "model_binding_mode": "FORBIDDEN",
      "runtime_binding_mode": "OPTIONAL_EXACT_IF_ROUTE_BINDS",
      "gpu_count": 1,
      "admission_enabled_after_generic_activation": true
    },
    "model-single-offline-v1": {
      "lifecycle": "ACCEPTED_MIGRATION_EQUIVALENT",
      "execution_plane": "jit_runner",
      "execution_profile": "gpu-small",
      "resource_class": "model_eval_single_gpu_v1",
      "payload_network_class": "GITHUB_CONTROL_PLANE_ONLY_PAYLOAD_OFFLINE",
      "payload_secret_class": "CONTROL_PLANE_EPHEMERAL_ONLY",
      "filesystem_class": "EPHEMERAL_JOB_PLUS_EXACT_TRUSTED_READONLY",
      "cache_access_class": "TRUSTED_MODEL_RUNTIME_READONLY",
      "state_effect_class": "NON_SCIENTIFIC_MODEL_EVAL_ONLY",
      "candidate_payload_allowed": true,
      "model_binding_mode": "REQUIRED_PROMOTED_EXACT",
      "runtime_binding_mode": "REQUIRED_EXPANDED_RUNTIME_EXACT",
      "gpu_count": 1,
      "admission_enabled_after_generic_activation": true
    },
    "model-dual-offline-v1": {
      "lifecycle": "ACCEPTED_MIGRATION_EQUIVALENT",
      "execution_plane": "jit_runner",
      "execution_profile": "gpu-heavy",
      "resource_class": "model_eval_dual_gpu_v1",
      "payload_network_class": "GITHUB_CONTROL_PLANE_ONLY_PAYLOAD_OFFLINE",
      "payload_secret_class": "CONTROL_PLANE_EPHEMERAL_ONLY",
      "filesystem_class": "EPHEMERAL_JOB_PLUS_EXACT_TRUSTED_READONLY",
      "cache_access_class": "TRUSTED_MODEL_RUNTIME_READONLY",
      "state_effect_class": "NON_SCIENTIFIC_MODEL_EVAL_ONLY",
      "candidate_payload_allowed": true,
      "model_binding_mode": "REQUIRED_PROMOTED_EXACT",
      "runtime_binding_mode": "REQUIRED_EXPANDED_RUNTIME_EXACT",
      "gpu_count": 2,
      "admission_enabled_after_generic_activation": true
    },
    "model-dual-public-v1": {
      "lifecycle": "ACCEPTED_MIGRATION_EQUIVALENT",
      "execution_plane": "jit_runner",
      "execution_profile": "gpu-heavy",
      "resource_class": "model_eval_dual_gpu_v1",
      "payload_network_class": "GITHUB_CONTROL_PLANE_PLUS_PUBLIC_PAYLOAD",
      "payload_secret_class": "CONTROL_PLANE_EPHEMERAL_ONLY",
      "filesystem_class": "EPHEMERAL_JOB_PLUS_EXACT_TRUSTED_READONLY",
      "cache_access_class": "TRUSTED_MODEL_RUNTIME_READONLY",
      "state_effect_class": "NON_SCIENTIFIC_MODEL_EVAL_ONLY",
      "candidate_payload_allowed": true,
      "model_binding_mode": "REQUIRED_PROMOTED_EXACT",
      "runtime_binding_mode": "REQUIRED_EXPANDED_RUNTIME_EXACT",
      "gpu_count": 2,
      "admission_enabled_after_generic_activation": true
    },
    "gpu-dual-public-ci-v1": {
      "lifecycle": "PLANNED_NOT_ACCEPTED",
      "execution_plane": "jit_runner",
      "execution_profile": "gpu-heavy",
      "resource_class": "PLANNED_GENERIC_DUAL_GPU_RESOURCE",
      "payload_network_class": "GITHUB_CONTROL_PLANE_PLUS_PUBLIC_PAYLOAD",
      "payload_secret_class": "CONTROL_PLANE_EPHEMERAL_ONLY",
      "filesystem_class": "EPHEMERAL_JOB_PLUS_EXACT_TRUSTED_READONLY",
      "cache_access_class": "EXACT_TRUSTED_OBJECTS_READONLY_OR_NONE",
      "state_effect_class": "CI_VALIDATION_ONLY",
      "candidate_payload_allowed": true,
      "model_binding_mode": "OPTIONAL_EXACT_IF_ROUTE_BINDS",
      "runtime_binding_mode": "OPTIONAL_EXACT_IF_ROUTE_BINDS",
      "gpu_count": 2,
      "admission_enabled_after_generic_activation": false
    },
    "control-small-ci-v1": {
      "lifecycle": "P1_CONTROL_PILOT_REVIEW_REQUIRED",
      "execution_plane": "jit_runner",
      "execution_profile": "control-small",
      "resource_class": "control_small_v1",
      "payload_network_class": "GITHUB_CONTROL_PLANE_PLUS_PUBLIC_PAYLOAD",
      "payload_secret_class": "CONTROL_PLANE_EPHEMERAL_ONLY",
      "filesystem_class": "EPHEMERAL_JOB_ONLY",
      "cache_access_class": "NO_PERSISTENT_CACHE_AUTHORITY",
      "state_effect_class": "CI_VALIDATION_ONLY",
      "candidate_payload_allowed": true,
      "model_binding_mode": "FORBIDDEN",
      "runtime_binding_mode": "OPTIONAL_EXACT_IF_ROUTE_BINDS",
      "gpu_count": 0,
      "admission_enabled_after_generic_activation": true
    }
  }
}
